[
  {
    "category": "DEMOGRAPHIC",
    "vector": "Age",
    "value": "0-4 (Toddlers/Preschoolers)",
    "description": "",
    "insights": [],
    "is_active": true
  },
  {
    "category": "DEMOGRAPHIC",
    "vector": "Age",
    "value": "5-12 (Children)",
    "description": "",
    "insights": [],
    "is_active": true
  },
  {
    "category": "DEMOGRAPHIC",
    "vector": "Age",
    "value": "13-17 (Teens)",
    "description": "",
    "insights": [],
    "is_active": true
  },
  {
    "category": "DEMOGRAPHIC",
    "vector": "Age",
    "value": "18-24 (Young Adults/Gen Z)",
    "description": "",
    "insights": [],
    "is_active": true
  },
  {
    "category": "DEMOGRAPHIC",
    "vector": "Age",
    "value": "25-34 (Millennials - Younger)",
    "description": "",
    "insights": [],
    "is_active": true
  },
  {
    "category": "DEMOGRAPHIC",
    "vector": "Age",
    "value": "35-44 (Millennials - Older)",
    "description": "",
    "insights": [],
    "is_active": true
  },
  {
    "category": "DEMOGRAPHIC",
    "vector": "Age",
    "value": "45-54 (Gen X)",
    "description": "",
    "insights": [],
    "is_active": true
  },
  {
    "category": "DEMOGRAPHIC",
    "vector": "Age",
    "value": "55-64 (Boomers - Younger)",
    "description": "",
    "insights": [],
    "is_active": true
  },
  {
    "category": "DEMOGRAPHIC",
    "vector": "Age",
    "value": "65+ (Seniors/Retirees)",
    "description": "",
    "insights": [],
    "is_active": true
  },
  {
    "category": "DEMOGRAPHIC",
    "vector": "Generation",
    "value": "Silent Generation (Born 1928-1945)",
    "description": "",
    "insights": [],
    "is_active": true
  },
  {
    "category": "DEMOGRAPHIC",
    "vector": "Generation",
    "value": "Baby Boomers (Born 1946-1964)",
    "description": "",
    "insights": [],
    "is_active": true
  },
  {
    "category": "DEMOGRAPHIC",
    "vector": "Generation",
    "value": "Generation X (Born 1965-1980)",
    "description": "",
    "insights": [],
    "is_active": true
  },
  {
    "category": "DEMOGRAPHIC",
    "vector": "Generation",
    "value": "Millennials (Born 1981-1996)",
    "description": "",
    "insights": [],
    "is_active": true
  },
  {
    "category": "DEMOGRAPHIC",
    "vector": "Generation",
    "value": "Generation Z (Born 1997-2012)",
    "description": "",
    "insights": [],
    "is_active": true
  },
  {
    "category": "DEMOGRAPHIC",
    "vector": "Generation",
    "value": "Generation Alpha (Born 2013+)",
    "description": "",
    "insights": [],
    "is_active": true
  },
  {
    "category": "DEMOGRAPHIC",
    "vector": "Gender Identity",
    "value": "Male",
    "description": "",
    "insights": [],
    "is_active": true
  },
  {
    "category": "DEMOGRAPHIC",
    "vector": "Gender Identity",
    "value": "Female",
    "description": "",
    "insights": [],
    "is_active": true
  },
  {
    "category": "DEMOGRAPHIC",
    "vector": "Gender Identity",
    "value": "Non-Binary",
    "description": "",
    "insights": [],
    "is_active": true
  },
  {
    "category": "DEMOGRAPHIC",
    "vector": "Gender Identity",
    "value": "Gender Fluid",
    "description": "",
    "insights": [],
    "is_active": true
  },
  {
    "category": "DEMOGRAPHIC",
    "vector": "Gender Identity",
    "value": "Prefer Not to Disclose",
    "description": "",
    "insights": [],
    "is_active": true
  },
  {
    "category": "DEMOGRAPHIC",
    "vector": "Household Income",
    "value": "Under $25K",
    "description": "",
    "insights": [],
    "is_active": true
  },
  {
    "category": "DEMOGRAPHIC",
    "vector": "Household Income",
    "value": "$25K-$35K",
    "description": "",
    "insights": [],
    "is_active": true
  },
  {
    "category": "DEMOGRAPHIC",
    "vector": "Household Income",
    "value": "$35K-$50K",
    "description": "",
    "insights": [],
    "is_active": true
  },
  {
    "category": "DEMOGRAPHIC",
    "vector": "Household Income",
    "value": "$50K-$75K",
    "description": "",
    "insights": [],
    "is_active": true
  },
  {
    "category": "DEMOGRAPHIC",
    "vector": "Household Income",
    "value": "$75K-$100K",
    "description": "",
    "insights": [],
    "is_active": true
  },
  {
    "category": "DEMOGRAPHIC",
    "vector": "Household Income",
    "value": "$100K-$150K",
    "description": "",
    "insights": [],
    "is_active": true
  },
  {
    "category": "DEMOGRAPHIC",
    "vector": "Household Income",
    "value": "$150K-$250K",
    "description": "",
    "insights": [],
    "is_active": true
  },
  {
    "category": "DEMOGRAPHIC",
    "vector": "Household Income",
    "value": "$250K+",
    "description": "",
    "insights": [],
    "is_active": true
  },
  {
    "category": "DEMOGRAPHIC",
    "vector": "Income Tier",
    "value": "Low Income",
    "description": "",
    "insights": [],
    "is_active": true
  },
  {
    "category": "DEMOGRAPHIC",
    "vector": "Income Tier",
    "value": "Lower-Middle Income",
    "description": "",
    "insights": [],
    "is_active": true
  },
  {
    "category": "DEMOGRAPHIC",
    "vector": "Income Tier",
    "value": "Middle Income",
    "description": "",
    "insights": [],
    "is_active": true
  },
  {
    "category": "DEMOGRAPHIC",
    "vector": "Income Tier",
    "value": "Upper-Middle Income",
    "description": "",
    "insights": [],
    "is_active": true
  },
  {
    "category": "DEMOGRAPHIC",
    "vector": "Income Tier",
    "value": "Affluent",
    "description": "",
    "insights": [],
    "is_active": true
  },
  {
    "category": "DEMOGRAPHIC",
    "vector": "Income Tier",
    "value": "High Net Worth",
    "description": "",
    "insights": [],
    "is_active": true
  },
  {
    "category": "DEMOGRAPHIC",
    "vector": "Education Level",
    "value": "Less than High School",
    "description": "",
    "insights": [],
    "is_active": true
  },
  {
    "category": "DEMOGRAPHIC",
    "vector": "Education Level",
    "value": "High School Graduate/GED",
    "description": "",
    "insights": [],
    "is_active": true
  },
  {
    "category": "DEMOGRAPHIC",
    "vector": "Education Level",
    "value": "Some College/No Degree",
    "description": "",
    "insights": [],
    "is_active": true
  },
  {
    "category": "DEMOGRAPHIC",
    "vector": "Education Level",
    "value": "Associate Degree",
    "description": "",
    "insights": [],
    "is_active": true
  },
  {
    "category": "DEMOGRAPHIC",
    "vector": "Education Level",
    "value": "Bachelor's Degree",
    "description": "",
    "insights": [],
    "is_active": true
  },
  {
    "category": "DEMOGRAPHIC",
    "vector": "Education Level",
    "value": "Master's Degree",
    "description": "",
    "insights": [],
    "is_active": true
  },
  {
    "category": "DEMOGRAPHIC",
    "vector": "Education Level",
    "value": "Doctoral/Professional Degree",
    "description": "",
    "insights": [],
    "is_active": true
  },
  {
    "category": "DEMOGRAPHIC",
    "vector": "Occupation Type",
    "value": "Professional/White Collar",
    "description": "",
    "insights": [],
    "is_active": true
  },
  {
    "category": "DEMOGRAPHIC",
    "vector": "Occupation Type",
    "value": "Management/Executive",
    "description": "",
    "insights": [],
    "is_active": true
  },
  {
    "category": "DEMOGRAPHIC",
    "vector": "Occupation Type",
    "value": "Technical/Engineering",
    "description": "",
    "insights": [],
    "is_active": true
  },
  {
    "category": "DEMOGRAPHIC",
    "vector": "Occupation Type",
    "value": "Sales/Marketing",
    "description": "",
    "insights": [],
    "is_active": true
  },
  {
    "category": "DEMOGRAPHIC",
    "vector": "Occupation Type",
    "value": "Service/Hospitality",
    "description": "",
    "insights": [],
    "is_active": true
  },
  {
    "category": "DEMOGRAPHIC",
    "vector": "Occupation Type",
    "value": "Blue Collar/Manufacturing",
    "description": "",
    "insights": [],
    "is_active": true
  },
  {
    "category": "DEMOGRAPHIC",
    "vector": "Occupation Type",
    "value": "Creative/Arts",
    "description": "",
    "insights": [],
    "is_active": true
  },
  {
    "category": "DEMOGRAPHIC",
    "vector": "Occupation Type",
    "value": "Healthcare",
    "description": "",
    "insights": [],
    "is_active": true
  },
  {
    "category": "DEMOGRAPHIC",
    "vector": "Occupation Type",
    "value": "Education",
    "description": "",
    "insights": [],
    "is_active": true
  },
  {
    "category": "DEMOGRAPHIC",
    "vector": "Occupation Type",
    "value": "Government/Public Service",
    "description": "",
    "insights": [],
    "is_active": true
  },
  {
    "category": "DEMOGRAPHIC",
    "vector": "Occupation Type",
    "value": "Retired",
    "description": "",
    "insights": [],
    "is_active": true
  },
  {
    "category": "DEMOGRAPHIC",
    "vector": "Occupation Type",
    "value": "Student",
    "description": "",
    "insights": [],
    "is_active": true
  },
  {
    "category": "DEMOGRAPHIC",
    "vector": "Occupation Type",
    "value": "Unemployed/Not Working",
    "description": "",
    "insights": [],
    "is_active": true
  },
  {
    "category": "DEMOGRAPHIC",
    "vector": "Occupation Type",
    "value": "Self-Employed/Entrepreneur",
    "description": "",
    "insights": [],
    "is_active": true
  },
  {
    "category": "DEMOGRAPHIC",
    "vector": "Employment Status",
    "value": "Full-Time Employed",
    "description": "",
    "insights": [],
    "is_active": true
  },
  {
    "category": "DEMOGRAPHIC",
    "vector": "Employment Status",
    "value": "Part-Time Employed",
    "description": "",
    "insights": [],
    "is_active": true
  },
  {
    "category": "DEMOGRAPHIC",
    "vector": "Employment Status",
    "value": "Self-Employed",
    "description": "",
    "insights": [],
    "is_active": true
  },
  {
    "category": "DEMOGRAPHIC",
    "vector": "Employment Status",
    "value": "Unemployed - Seeking Work",